UKPRN,UnitOfAssessment,MultipleSubmission,Identifier,OutputType,Title,Place,Publisher,VolumeTitle,Volume,Issue,FirstPage,ArticleNumber,ISBN,ISSN,DOI,PatentNumber,Year,URL,NumberOfAdditionalAuthors,IsNonEnglishOutput,IsInterdisciplinary,ProposeDoubleWeighting,IsReserveOutput,DoubleWeightingStatement,EnglishAbstract,ResearchGroup,CitedByCount,CrossReferToUoa,CitationsApplicable,AdditionalInformation
10007160,18,,1398847,D,Tax reform and labour-market performance in the euro area: A simulation-based analysis using the New Area-Wide Model,,,Journal of Economic Dynamics and Control,32,8,2543,,,01651889,10.1016/j.jedc.2007.09.007,,2008,,,False,,False,False,,,,29,,True,
10007160,18,,1398848,D,Robust monetary rules under unstructured model uncertainty,,,Journal of Economic Dynamics and Control,34,3,456,,,01651889,10.1016/j.jedc.2009.10.003,,2010,,,False,,False,False,,,,2,,True,
10007160,18,,1398849,D,Popularity of reinforcement-based and belief-based learning models: An evolutionary approach,,,Journal of Economic Dynamics and Control,36,3,433,,,01651889,10.1016/j.jedc.2011.10.002,,2012,,,False,,False,False,,,,1,,True,
10007160,18,,1398850,D,Getting normalization right: Dealing with ‘dimensional constants’ in macroeconomics,,,Journal of Economic Dynamics and Control,36,12,1931,,,01651889,10.1016/j.jedc.2012.05.009,,2012,,,False,,False,False,,,,0,,True,
10007160,18,,1398851,D,Optimal voting schemes with costly information acquisition,,,Journal of Economic Theory,144,1,36,,,00220531,10.1016/j.jet.2008.02.004,,2009,,,False,,False,False,,,,15,,True,
10007160,18,,1398852,D,Repeated games with one-memory,,,Journal of Economic Theory,144,1,312,,,00220531,10.1016/j.jet.2008.04.003,,2009,,,False,,False,False,,,,6,,True,
10007160,18,,1398853,D,An existence result for discontinuous games,,,Journal of Economic Theory,144,3,1333,,,00220531,10.1016/j.jet.2008.11.004,,2009,,,False,,False,False,,,,13,,True,
10007160,18,,1398854,D,On the existence of pure-strategy equilibria in large games,,,Journal of Economic Theory,144,3,1300,,,00220531,10.1016/j.jet.2008.11.009,,2009,,,False,,False,False,,,,5,,True,
10007160,18,,1398855,D,"Securities market theory: Possession, repo and rehypothecation",,,Journal of Economic Theory,147,2,477,,,00220531,10.1016/j.jet.2010.11.004,,2012,,,False,,False,False,,,,3,,True,
10007160,18,,1398856,D,"General equilibrium, wariness and efficient bubbles",,,Journal of Economic Theory,146,3,785,,,00220531,10.1016/j.jet.2011.01.005,,2011,,,False,,False,False,,,,2,,True,
10007160,18,,1398858,D,Is the GATT/WTO's Article XXIV bad?,,,Journal of International Economics,89,1,216,,,00221996,10.1016/j.jinteco.2012.07.007,,2013,,,False,,False,False,,,,1,,True,
10007160,18,,1398859,D,New Keynesian Phillips Curves and potential identification failures: A Generalized Empirical Likelihood analysis,,,Journal of Macroeconomics,31,4,561,,,01640704,10.1016/j.jmacro.2009.01.003,,2009,,,False,,False,False,,,,3,,True,
10007160,18,,1398860,D,Quantifying and sustaining welfare gains from monetary commitment,,,Journal of Monetary Economics,55,7,1253,,,03043932,10.1016/j.jmoneco.2008.08.009,,2008,,,False,,False,False,,,,7,,True,
10007160,18,,1398861,D,Macroeconomic determinants of stock volatility and volatility premiums,,,Journal of Monetary Economics,60,,203,,,03043932,10.1016/j.jmoneco.2012.10.019,,2013,,,False,,False,False,,,,0,,True,
10007160,18,,1398862,D,The literacy hour,,,Journal of Public Economics,92,5-6,1441,,,00472727,10.1016/j.jpubeco.2007.11.008,,2008,,,False,,False,False,,,,18,,True,
10007160,18,,1398863,D,Some properties of tests for parameters that can be arbitrarily close to being unidentified,,,Journal of Statistical Planning and Inference,139,9,3193,,,03783758,10.1016/j.jspi.2009.02.020,,2009,,,False,,False,False,,,,0,,True,
10007160,18,,1398864,D,Disciplinary sanctions in English Premiership Football: Is there a racial dimension?,,,Labour Economics,18,3,360,,,09275371,10.1016/j.labeco.2010.12.006,,2011,,,False,,False,False,,,,0,,True,
10007160,18,,1398867,D,WEIGHTED AVERAGE POWER SIMILAR TESTS FOR STRUCTURAL CHANGE IN THE GAUSSIAN LINEAR REGRESSION MODEL,,,Econometric Theory,24,05,1277,,,1469-4360,10.1017/S026646660808050X,,2008,,,False,,False,False,,,,0,,True,
10007160,18,,1398868,D,POWER PROPERTIES OF INVARIANT TESTS FOR SPATIAL AUTOCORRELATION IN LINEAR REGRESSION,,,Econometric Theory,26,01,152,,,1469-4360,10.1017/S0266466609090641,,2009,,,False,,False,False,,,,10,,True,
10007160,18,,1398869,D,THE ASYMPTOTIC DISTRIBUTION OF THE LIML ESTIMATOR IN A PARTIALLY IDENTIFIED STRUCTURAL EQUATION,,,Econometric Theory,26,03,917,,,1469-4360,10.1017/S0266466609990156,,2009,,,False,,False,False,,,,0,,True,
10007160,18,,1398870,D,NONTESTABILITY OF EQUAL WEIGHTS SPATIAL DEPENDENCE,,,Econometric Theory,27,06,1369,,,1469-4360,10.1017/S0266466611000089,,2011,,,False,,False,False,,,,3,,True,
10007160,18,,1398871,D,THE CORRELATION STRUCTURE OF SPATIAL AUTOREGRESSIONS,,,Econometric Theory,28,06,1373,,,1469-4360,10.1017/S0266466612000175,,2012,,,False,,False,False,,,,0,,True,
10007160,18,,1398872,D,Identifying Jumps in Financial Assets: A Comparison Between Nonparametric Jump Tests,,,Journal of Business & Economic Statistics,30,2,242,,,1537-2707,10.1080/07350015.2012.663250,,2012,,,False,,False,False,,,,2,,True,
10007160,18,,1398873,D,Testing for Spatial Autocorrelation: The Regressors that Make the Power Disappear,,,Econometric Reviews,31,2,215,,,1532-4168,10.1080/07474938.2011.553571,,2012,,,False,,False,False,,,,2,,True,
10007160,18,,1398874,D,"Red cards, referee home bias and social pressure: evidence from English Premiership Soccer",,,Applied Economics Letters,20,7,710,,,1466-4291,10.1080/13504851.2012.734591,,2013,,,False,,False,False,,,,0,,True,
10007160,18,,1398875,D,Dynamic Contracts with Moral Hazard and Adverse Selection,,,The Review of Economic Studies,79,1,268,,,1467-937X,10.1093/restud/rdr026,,2011,,,False,,False,False,,,,0,,True,
10007160,18,,1398877,D,Adverse Selection and Entrepreneurship in a Model of Development,,,Scandinavian Journal of Economics,112,1,77,,,14679442,10.1111/j.1467-9442.2009.01595.x,,2010,,,False,,False,False,,,,6,,True,
10007160,18,,1398878,D,Intergenerational persistence in income and social class: the effect of within-group inequality,,,Journal of the Royal Statistical Society: Series A (Statistics in Society),176,2,541,,,09641998,10.1111/j.1467-985X.2012.01053.x,,2012,,,False,,False,False,,,,1,,True,
10007160,18,,1398879,D,Endogenous Persistence in an estimated DSGE Model Under Imperfect Information*,,,The Economic Journal,122,565,1287,,,00130133,10.1111/j.1468-0297.2012.02524.x,,2012,,,False,,False,False,,,,1,,True,
10007160,18,,1398880,D,The Cost Channel Reconsidered: A Comment Using an Identification-Robust Approach,,,"Journal of Money, Credit and Banking",42,8,1703,,,00222879,10.1111/j.1538-4616.2010.00361.x,,2010,,,False,,False,False,,,,0,,True,
10007160,18,,1398881,D,QUALITY LADDERS IN A RICARDIAN MODEL OF TRADE WITH NONHOMOTHETIC PREFERENCES,,,Journal of the European Economic Association,10,4,908,,,15424766,10.1111/j.1542-4774.2012.01077.x,,2012,,,False,,False,False,,,,1,,True,
10007160,18,,1398882,D,Predictive Inference for Integrated Volatility,,,Journal of the American Statistical Association,106,496,1496,,,1537-274X,10.1198/jasa.2011.tm10012,,2011,,,False,,False,False,,,,2,,True,
10007160,18,,1398883,D,Identifying the Elasticity of Substitution with Biased Technical Change,,,American Economic Review,100,4,1330,,,0002-8282,10.1257/aer.100.4.1330,,2010,,,False,,False,False,,,,20,,True,
10007160,18,,1398884,D,"Panic on the Streets of London: Police, Crime, and the July 2005 Terror Attacks",,,American Economic Review,101,5,2157,,,0002-8282,10.1257/aer.101.5.2157,,2011,,,False,,False,False,,,,11,,True,
10007160,18,,1398885,D,Learning about the Future and Dynamic Efficiency,,,American Economic Review,99,4,1576,,,0002-8282,10.1257/aer.99.4.1576,,2009,,,False,,False,False,,,,9,,True,
10007160,18,,1398886,D,On the Equivalence of Bayesian and Dominant Strategy Implementation,,,Econometrica,81,1,197,,,0012-9682,10.3982/ECTA10592,,2013,,,False,,False,False,,,,,,True,
10007160,18,,1398887,D,"QUALITY OF AVAILABLE MATES, EDUCATION, AND HOUSEHOLD LABOR SUPPLY",,,Economic Inquiry,48,3,558,,,00952583,10.1111/j.1465-7295.2008.00132.x,,2008,,,False,,False,False,,,,1,,True,
10007160,18,,1398888,D,Fatter Attraction: Anthropometric and Socioeconomic Matching on the Marriage Market,,,Journal of Political Economy,120,4,659,,,1537534X,10.1086/667941,,2012,,,False,,False,False,,,,0,,True,
10007160,18,,1398889,D,Birth Control and Female Empowerment: An Equilibrium Analysis,,,Journal of Political Economy,116,1,113,,,1537-534X,10.1086/529409,,2008,,,False,,False,False,,,,9,,True,
10007160,18,,1398890,D,Sexual orientation and household decision making.,,,Labour Economics,18,2,145,,,09275371,10.1016/j.labeco.2010.09.003,,2011,,,False,,False,False,,,,7,,True,
10007160,18,,1398942,D,Information and the Disposition of Medical Malpractice Claims: A Competing Risks Analysis,,,"Journal of Law, Economics, and Organization",n/a,,n/a,n/a,,1465-7341,10.1093/jleo/ewt002,,2013,,,False,,False,False,,,,,,True,
10007160,18,,1398943,D,"Enterprise Liability, Risk Pooling, and Diagnostic Care",,,Journal of Public Administration Research and Theory,20,Supplement 2,i225,,,1477-9803,10.1093/jopart/muq026,,2010,,,False,,False,False,,,,3,,True,
10007160,18,,1398956,D,"The Impact of Risk Management Standards on Patient Safety: The Determinants of MRSA Infections in Acute NHS Hospitals, 2001-08",,,Oxford Bulletin of Economics and Statistics,75,3,340,,,03059049,10.1111/j.1468-0084.2012.00694.x,,2012,,,False,,False,False,,,,0,,True,
10007160,18,,1398969,D,Fixing Lawyers' Fees Ex Ante: A Case Study in Policy and Empirical Legal Studies,,,Journal of Empirical Legal Studies,8,3,533,,,17401453,10.1111/j.1740-1461.2011.01219.x,,2011,,,False,,False,False,,,,2,,True,
10007160,18,,2384590,D,Anticipation of Future Consumption: A Monetary Perspective,,,"Journal of Money, Credit and Banking",45,2-3,423,,,00222879,10.1111/jmcb.12008,,2013,,,False,,False,False,,,,0,,True,
10007160,18,,2661650,D,Bargaining with endogenous disagreement: The extended Kalai–Smorodinsky solution,,,Games and Economic Behavior,74,1,407,,,08998256,10.1016/j.geb.2011.06.007,,2012,,,False,,False,False,,,,0,,True,
10007160,18,,2661651,D,Linear instrumental variables model averaging estimation,,,Computational Statistics & Data Analysis,n/a,,n/a,n/a,,01679473,10.1016/j.csda.2013.05.008,,2013,,,False,,False,False,,,,0,,True,
10007160,18,,2684002,U,Medium-Frequency Cycles and the Remarkable Near Trends-Stationarity of Output,,School of Economics Discussion Papers,,,,,,,,,,2012,http://www.fahs.surrey.ac.uk/economics/discussion_papers/2012/DP14-12.pdf,,False,,False,False,,,,,,False,
10007160,18,,2684038,D,Semiparametric estimation of Markov decision processes with continuous state space,,,Journal of Econometrics,166,2,320,,,03044076,10.1016/j.jeconom.2011.10.003,,2012,,,False,,False,False,,,,0,,True,
10007160,18,,2693867,U,"Shocking Stuff: Technology, Hours,
and Factor Substitution",,European Central Bank Working Paper Series,,,,,,,,,,2010,http://www.ecb.europa.eu,,False,,False,False,,,,,,False,
10007160,18,,2693896,D,Vive la Révolution! Long‐Term Educational Returns of 1968 to the Angry Students,,,Journal of Labor Economics,26,1,1,,,1537-5307,10.1086/522071,,2008,,,False,,False,False,,,,12,,True,
10007160,18,,2693898,D,The Effect of Tracking Students by Ability into Different Schools: a Natural Experiment,,,Journal of Human Resources,47,3,684,,,1548-8004,10.1353/jhr.2012.0022,,2012,,,False,,False,False,,,,1,,True,
10007160,18,,2693964,D,Non-native speakers of English in the classroom: what are the effects on pupil performance?,,,The Economic Journal,123,570,F281,,,1468-0297,10.1111/ecoj.12054,,2013,,,False,,False,False,,,,1,,True,
10007160,18,,2693974,D,"Technology, Utilization, and Inflation: What Drives the New Keynesian Phillips Curve?",,,"Journal of Money, Credit and Banking",45,8,1547,,,00222879,10.1111/jmcb.12062,,2013,,,False,,False,False,,,,,,True,
10007160,18,,2693978,D,The dynamics of US inflation: Can monetary policy explain the changes?,,,Journal of Econometrics,167,1,47,,,03044076,10.1016/j.jeconom.2011.08.008,,2012,,,False,,False,False,,,,1,,True,
10007806,18,,3357785,D,"War legacies, welfare and livelihoods in rural areas: the case of Kosovo",,,Journal of Agricultural Economics,63,1,201,,,0021-857X,10.1111/j.1477-9552.2011.00328.x,,2012,http://dx.doi.org/10.1111/j.1477-9552.2011.00328.x,2,False,,False,False,,,,1,,True,
10007806,18,,3357791,D,Poverty Dynamics during Trade Reform: Evidence from Rural Vietnam,,,Review of Income and Wealth,54,2,166,,,0034-6586,10.1111/j.1475-4991.2008.00269.x,,2008,http://dx.doi.org/10.1111/j.1475-4991.2008.00269.x,2,False,,False,False,,,,5,,True,
10007806,18,,3357796,D,An analysis of life satisfaction in Albania: an heteroscedastic ordered probit model approach,,,Journal of Economic Behavior and Organization,81,3,731,,,0167-2681,10.1016/j.jebo.2010.12.020,,2012,http://dx.doi.org/10.1016/j.jebo.2010.12.020,2,False,,False,False,,,,1,,True,
10007806,18,,3357800,D,Compulsory language educational policies and identity formation,,,Journal of the European Economic Association,6,2-3,434,,,1542-4766,10.1162/JEEA.2008.6.2-3.434,,2008,http://dx.doi.org/10.1162/JEEA.2008.6.2-3.434,3,False,,False,False,,,,9,,True,
10007806,18,,3357804,D,Markets and jungles,,,Journal of Economic Growth,17,2,103,,,1381-4338,10.1007/s10887-011-9076-z,,2012,http://dx.doi.org/10.1007/s10887-011-9076-z,1,False,,False,False,,,,1,,True,
10007806,18,,3357806,D,"Education, language and identity",,,Economic Journal,N/A,,N/A,N/A,,0013-0133,10.1111/ecoj.12051,,2013,http://dx.doi.org/10.1111/ecoj.12051,1,False,,False,False,,,,1,,True,
10007806,18,,3357807,D,The end of destitution: evidence from urban British working households 1904-1937,,,Oxford Economic Papers,64,1,80,,,0030-7653,10.1093/oep/gpr032,,2012,http://dx.doi.org/10.1093/oep/gpr032,1,False,,False,False,,,,0,,True,
10007806,18,,3357808,D,Poverty in Edwardian Britain,,,Economic History Review,64,1,52,,,0013-0117,10.1111/j.1468-0289.2009.00523.x,,2011,http://dx.doi.org/10.1111/j.1468-0289.2009.00523.x,1,False,,False,False,,,,1,,True,
10007806,18,,3357809,C,Farm size,,Elsevier North-Holland,Handbook of Agricultural Economics: Agricultural Development: Farm Policies and Regional Development,,,,,978-0-444-51874-3,,10.1016/S1574-0072(09)04065-1,,2009,,4,False,,False,False,,,,,,False,
10007806,18,,3357810,D,The First World War and working-class food consumption in Britain,,,European Review of Economic History,17,1,71,,,1361-4916,10.1093/ereh/hes018,,2013,http://dx.doi.org/10.1093/ereh/hes018,1,False,,False,False,,,,1,,True,
10007806,18,,3357811,D,"Faith schools, social capital and academic attainment: evidence from TIMSS-R mathematics scores in Flemish secondary schools",,,British Educational Research Journal,34,2,235,,,0141-1926,10.1080/01411920701532178,,2008,http://dx.doi.org/10.1080/01411920701532178,1,False,,False,False,,,,4,,True,
10007806,18,,3357812,D,"Competition, Cream-Skimming and Department Performance within Secondary Schools",,,British Educational Research Journal,35,1,65,,,0141-1926,10.1080/01411920802041707,,2009,http://dx.doi.org/10.1080/01411920802041707,4,False,,False,False,,,,2,,True,
10007806,18,,3357813,D,Pupil mobility and school disruption,,,Journal of Public Economics,95,9-10,1156,,,0047-2727,10.1016/j.jpubeco.2011.03.004,,2011,http://dx.doi.org/10.1016/j.jpubeco.2011.03.004,1,False,,False,False,,,,0,,True,
10007806,18,,3357814,D,Non-native speakers of English in the classroom: what are the effects on pupil performance?,,,Economic Journal,N/A,,N/A,N/A,,00130133,10.1111/ecoj.12054,,2013,http://dx.doi.org/10.1111/ecoj.12054,2,False,,False,False,,,,1,,True,
10007806,18,,3357815,D,Domestic burglaries and the real price of audio-visual goods: Some time series evidence for Britain,,,Economics Letters,100,1,96,,,0165-1765,10.1016/j.econlet.2007.11.005,,2008,http://dx.doi.org/10.1016/j.econlet.2007.11.005,1,False,,False,False,,,,1,,True,
10007806,18,,3357816,D,The determinants of water connection and water consumption: empirical evidence from a Cambodian household survey,,,World Development,36,5,953,,,0305-750X,10.1016/j.worlddev.2007.04.021,,2008,http://dx.doi.org/10.1016/j.worlddev.2007.04.021,2,False,,False,False,,,,12,,True,
10007806,18,,3357817,D,Disciplinary sanctions in English Premiership Football: Is there a racial dimension?,,,Labour Economics,18,3,360,,,09275371,10.1016/j.labeco.2010.12.006,,2011,http://dx.doi.org/10.1016/j.labeco.2010.12.006,1,False,,False,False,,,,0,,True,
10007806,18,,3357818,D,Length of compulsory education and voter turnout-evidence from a staged reform,,,Public Choice,150,1-2,51,,,0048-5829,10.1007/s11127-010-9689-3,,2012,http://dx.doi.org/10.1007/s11127-010-9689-3,0,False,,False,False,,,,0,,True,
10007806,18,,3357819,D,The Wage Effects of Computer Use: Evidence from WERS 2004,,,British Journal of Industrial Relations,46,4,587,,,0007-1080,10.1111/j.1467-8543.2008.00696.x,,2008,http://dx.doi.org/10.1111/j.1467-8543.2008.00696.x,1,False,,False,False,,,,3,,True,
10007806,18,,3357820,D,Education and mobility,,,The Journal of the European Economic Association,10,2,417,,,1542-4766,10.1111/j.1542-4774.2011.01048.x,,2012,http://dx.doi.org/10.1111/j.1542-4774.2011.01048.x,2,False,,False,False,,,,6,,True,
10007806,18,,3357821,D,If You Pay Peanuts Do You Get Monkeys? A Cross Country Analysis of Teacher Pay and Pupil Performance,,,Economic Policy,26,65,5,,,0266-4658,10.1111/j.1468-0327.2010.00257.x,,2011,http://www.economic-policy.org/abstract.asp?vid=26&iid=65&date=January+2011&aid=2,1,False,,False,False,,,,11,,True,
10007806,18,,3357822,D,"Employment, Inequality and the UK National Minimum Wage over the Medium-Term",,,Oxford Bulletin of Economics and Statistics,74,1,78,,,0305-9049,10.1111/j.1468-0084.2011.00653.x,,2012,http://onlinelibrary.wiley.com/doi/10.1111/j.1468-0084.2011.00653.x/abstract,2,False,,False,False,,,,1,,True,
10007806,18,,3357823,D,The International Experience of Minimum Wages in an Economic Downturn,,,Economic Policy,27,69,99,,,0266-4658,10.1111/j.1468-0327.2011.00278.x,,2012,http://dx.doi.org/10.1111/j.1468-0327.2011.00278.x,1,False,,False,False,,,,3,,True,
10007806,18,,3357824,D,Total reward and pensions in the UK in the public and private sectors,,,Labour Economics,19,4,584,,,0927-5371,10.1016/j.labeco.2012.05.010,,2012,http://dx.doi.org/10.1016/j.labeco.2012.05.010,1,False,,False,False,,,,0,,True,
10007806,18,,3357825,D,"Natural Resources, Democracy and Corruption",,,European Economic Review,54,4,608,,,0014-2921,10.1016/j.euroecorev.2009.10.004,,2010,http://dx.doi.org/10.1016/j.euroecorev.2009.10.004,1,False,,False,False,,,,29,,True,
10007806,18,,3357826,D,"Unbundled Institutions, Human Capital and Growth",,,Journal of Comparative Economics,37,1,106,,,0147-5967,10.1016/j.jce.2008.08.001,,2009,http://dx.doi.org/10.1016/j.jce.2008.08.001,0,False,,False,False,,,,8,,True,
10007806,18,,3357829,D,Trade liberalization and institutional development,,,Journal of Policy Modeling,34,2,253,,,0161-8938,10.1016/j.jpolmod.2011.08.005,,2012,http://dx.doi.org/10.1016/j.jpolmod.2011.08.005,0,False,,False,False,,,,1,,True,
10007806,18,,3357831,D,Public capital in resource rich economies: is there a curse?,,,Oxford Economic Papers,N/A,,N/A,N/A,,1464-3812,10.1093/oep/gps073,,2013,http://dx.doi.org/10.1093/oep/gps073,1,False,,False,False,,,,,,True,
10007806,18,,3357835,D,A swing-state theory of trade protection in the electoral college,,,Canadian Journal of Economics,46,2,705,,,0008-4085,10.1111/caje.12029,,2013,http://dx.doi.org/10.1111/caje.12029,1,False,,False,False,,,,0,,True,
10007806,18,,3357839,D,"Vertical product differentiation, minimum quality standards and international trade",,,Oxford Economic Papers,65,2,372,,,1471-0498,10.1093/oep/gps023,,2013,http://dx.doi.org/10.1093/oep/gps023,1,False,,False,False,,,,0,,True,
10007806,18,,3357842,D,Trade diversion under selective preferential market access,,,Canadian Journal of Economics,42,4,1390,,,0008-4085,10.1111/j.1540-5982.2009.01549.x,,2009,http://dx.doi.org/10.1111/j.1540-5982.2009.01549.x,0,False,,False,False,,,,1,,True,
10007806,18,,3357844,D,Policy barriers to international trade in services: evidence from a new database,,,World Bank Economic Review,N/A,,N/A,N/A,,0258-6770,10.1093/wber/lht017,,2013,http://dx.doi.org/10.1093/wber/lht017,2,False,,False,False,,,,,,True,
10007806,18,,3357846,D,On international equity weights and national decision making on climate change,,,Journal of Environmental Economics and Management,60,1,14,,,0095-0696,10.1016/j.jeem.2010.04.002,,2010,http://dx.doi.org/10.1016/j.jeem.2010.04.002,1,False,,False,False,,,,17,,True,
10007806,18,,3357848,D,The Economic Effects of Climate Change,,,Journal of Economic Perspectives,23,2,29,,,0895-3309,10.1257/jep.23.2.29,,2009,http://dx.doi.org/10.1257/jep.23.2.29,0,False,,False,False,,,,90,,True,
10007806,18,,3357850,D,Climate policy under the Bentham-Rawls criterion,,,Economics Letters,118,3,424,,,0165-1765,10.1016/j.econlet.2012.12.006,,2013,http://dx.doi.org/10.1016/j.econlet.2012.12.006,0,False,,False,False,,,,0,,True,
10007806,18,,3357853,D,Targets for global climate policy: an overview,,,Journal of Economic Dynamics and Control,37,5,911,,,0165-1889,10.1016/j.jedc.2013.01.001,,2013,http://dx.doi.org/10.1016/j.jedc.2013.01.001,0,False,,False,False,,,,0,,True,
10007806,18,,3357855,D,Happiness is greater in natural environments,,,Global Environmental Change,N/A,,N/A,N/A,,0959-3780,10.1016/j.gloenvcha.2013.03.010,,2013,http://dx.doi.org/10.1016/j.gloenvcha.2013.03.010,1,False,,False,False,,,,1,,True,
10007806,18,,3357858,D,Foreign direct investment and export upgrading,,,The Review of Economics and Statistics,94,4,964,,,1530-9142,10.1162/REST_a_00226,,2012,http://www.mitpressjournals.org/doi/pdf/10.1162/REST_a_00226,1,False,,False,False,,,,1,,True,
10007806,18,,3357860,D,Roll out the red carpet and they will come: investment promotion and FDI inflows,,,Economic Journal,121,557,1445,,,1468-0297,10.1111/j.1468-0297.2011.02454.x,,2011,http://onlinelibrary.wiley.com/doi/10.1111/j.1468-0297.2011.02454.x/pdf,1,False,,False,False,,,,3,,True,
10007806,18,,3357862,D,Inequality and polarisation in health systems’ responsiveness: a cross-country analysis,,,Journal of Health Economics,30,4,616,,,1879-1646,10.1016/j.jhealeco.2011.05.003,,2011,http://www.sciencedirect.com/science/article/pii/S0167629611000476,3,False,,False,False,,,,1,,True,
10007806,18,,3357865,D,Long-term effects of school quality on health and lifestyle: evidence from comprehensive schooling reforms in England,,,Journal of Human Capital,5,3,342,,,1932-8664,10.1086/662441,,2011,http://www.jstor.org/stable/10.1086/662441,2,False,,False,False,,,,1,,True,
10007806,18,,3357867,D,Driving under the (cellular) influence: the link between cell phone use and vehicle crashes,,,American Economic Journal: Economic Policy,5,3,92,,,1945-7731,10.1257/pol.5.3.92,,2013,http://dx.doi.org/10.1257/pol.5.3.92,1,False,,False,False,,,,0,,True,
10007806,18,,3357870,D,The effect of fast food restaurants on obesity and weight gain,,,American Economic Journal: Economic Policy,2,3,32,,,1945-7731,10.1257/pol.2.3.32,,2010,http://dx.doi.org/10.1257/pol.2.3.32,3,False,,False,False,,,,,,True,
10007806,18,,3357873,D,Identifying the aggregate productivity effects of entry and size restrictions: an empirical analysis of license reform in India,,,American Economic Journal: Economic Policy,3,2,66,,,1945-7731,10.1257/pol.3.2.66,,2011,http://dx.doi.org/10.1257/pol.3.2.66,0,False,,False,False,,,,2,,True,
10007806,18,,3357876,D,Firing costs and flexibility: evidence from firms’ employment responses to shocks in India,,,Review of Economics and Statistics,95,3,725,,,0034-6535,10.1162/REST_a_00305,,2013,http://dx.doi.org/10.1162/REST_a_00305,2,False,,False,False,,,,0,,True,
10007806,18,,3357880,D,Regulating altruistic agents,,,Canadian Journal of Economics,44,1,227,,,0008-4085,10.1111/j.1540-5982.2010.01630.x,,2011,http://dx.doi.org/10.1111/j.1540-5982.2010.01630.x,1,False,,False,False,,,,1,,True,
10007806,18,,3357886,D,"Angry customers, e-word-of-mouth and incentives for quality provision",,,Journal of Economic Behavior & Organization,84,3,813,,,01672681,10.1016/j.jebo.2012.10.002,,2012,http://dx.doi.org/10.1016/j.jebo.2012.10.002,1,False,,False,False,,,,0,,True,
10007806,18,,3357888,D,Community pressure for green behavior,,,Journal of Environmental Economics and Management,64,3,427,,,00950696,10.1016/j.jeem.2012.04.006,,2012,http://dx.doi.org/10.1016/j.jeem.2012.04.006,1,False,,False,False,,,,0,,True,
10007806,18,,3357890,D,Enforcement missions: targets vs budgets,,,Journal of Environmental Economics and Management,58,2,129,,,00950696,10.1016/j.jeem.2009.04.005,,2009,http://dx.doi.org/10.1016/j.jeem.2009.04.005,1,False,,False,False,,,,2,,True,
10007806,18,,3357891,D,"House price shocks, negative equity and household consumption in the United Kingdom",,,Journal of the European Economic Association,8,6,1179,,,1542-4766,10.1111/j.1542-4774.2010.tb00552.x,,2010,http://onlinelibrary.wiley.com/doi/10.1111/j.1542-4774.2010.tb00552.x/abstract,2,False,,False,False,,,,5,,True,
10007806,18,,3357892,D,What is a public sector pension worth?,,,Economic Journal,119,541,F517,,,0013-0133,10.1111/j.1468-0297.2009.02320.x,,2009,http://dx.doi.org/10.1111/j.1468-0297.2009.02320.x,2,False,,False,False,,,,7,,True,
10007806,18,,3357893,D,Reform of police pensions in England and Wales,,,Journal of Public Economics,N/A,,N/A,N/A,,0047-2727,10.1016/j.jpubeco.2013.05.006,,2013,http://www.sciencedirect.com/science/article/pii/S0047272713001138,1,False,,False,False,,,,0,,True,
