UKPRN,UnitOfAssessment,MultipleSubmission,Identifier,OutputType,Title,Place,Publisher,VolumeTitle,Volume,Issue,FirstPage,ArticleNumber,ISBN,ISSN,DOI,PatentNumber,Year,URL,NumberOfAdditionalAuthors,IsNonEnglishOutput,IsInterdisciplinary,ProposeDoubleWeighting,IsReserveOutput,DoubleWeightingStatement,EnglishAbstract,ResearchGroup,CitedByCount,CrossReferToUoa,CitationsApplicable,AdditionalInformation
10007791,18,,1219127,D,"Childhood economic conditions and length of life: Evidence from the UK Boyd Orr cohort, 1937-2005",,,Journal of Health Economics,29,1,39,,,0167-6296,10.1016/j.jhealeco.2009.10.004,,2010,,3,False,,False,False,,,,10,,True,
10007791,18,,1219128,D,The Rise and Fall of Asylum: What Happened and Why?,,,Economic Journal,119,535,F183,,,0013-0133,10.1111/j.1468-0297.2008.02228.x,,2009,,0,False,,False,False,,,,13,,True,
10007791,18,,1219129,D,"The effects on stature of poverty, family size, and birth order: British children in the 1930s",,,Oxford Economic Papers,62,1,157,,,1464-3812,10.1093/oep/gpp034,,2010,,1,False,,False,False,,,,8,,True,
10007791,18,,1219140,D,Do credit market shocks drive output fluctuations? Evidence from corporate spreads and defaults,,,Journal of Economic Dynamics and Control,36,4,568,,,0165-1889,10.1016/j.jedc.2011.11.010,,2012,,0,False,,False,False,,,,0,,True,
10007791,18,,1219141,D,The Dynamics of Economic Functions: Modeling and Forecasting the Yield Curve,,,Journal of the American Statistical Association,103,484,1419,,,0162-1459,10.1198/016214508000000922,,2008,,1,False,,False,False,,,,10,,True,
10007791,18,,1219142,D,An experiment on learning in a multiple games environment,,,Journal of Economic Theory,147,6,2220,,,0022-0531,10.1016/j.jet.2012.05.011,,2012,,1,False,,False,False,,,,0,,True,
10007791,18,,1219143,D,Learning across games,,,Games and Economic Behavior,74,2,601,,,0899-8256,10.1016/j.geb.2011.08.020,,2012,,0,False,,False,False,,,,2,,True,
10007791,18,,1219144,D,Strategic behavior in repeated voluntary contribution experiments,,,Journal of Public Economics,95,1,143,,,0047-2727,10.1016/j.jpubeco.2010.10.004,,2011,,1,False,,False,False,,,,1,,True,
10007791,18,,1219146,D,Optimal fiscal and monetary policies in the face of rare disasters,,,European Economic Review,55,1,75,,,0014-2921,10.1016/j.euroecorev.2010.11.001,,2011,,1,False,,False,False,,,,0,,True,
10007791,18,,1219147,D,Dynamic monetary-fiscal interactions and the role of monetary conservatism,,,Journal of Monetary Economics,58,3,234,,,0304-3932,10.1016/j.jmoneco.2011.03.008,,2011,,0,False,,False,False,,,,4,,True,
10007791,18,,1219148,D,Central Bank Independence And The Monetary Instrument Problem,,,International Economic Review,54,3,1031,,,0020-6598,10.1111/iere.12027,,2013,,2,False,,False,False,,,,0,,True,
10007791,18,,1219149,D,"Public debt, discretionary policy, and inflation persistence",,,Journal of Economic Dynamics and Control,37,6,1097,,,0165-1889,10.1016/j.jedc.2013.01.014,,2013,,2,False,,False,False,,,,0,,True,
10007791,18,,1219150,D,Studying Abroad and the Effect on International Labour Market Mobility: Evidence from the Introduction of ERASMUS,,,Economic Journal,121,551,194,,,0013-0133,10.1111/j.1468-0297.2010.02369.x,,2011,,1,False,,False,False,,,,7,,True,
10007791,18,,1219151,D,Measuring the price responsiveness of gasoline demand: Economic shape restrictions and nonparametric demand estimation,,,Quantitative Economics,3,1,29,,,1759-7323,10.3982/QE91,,2012,,2,False,,False,False,,,,0,,True,
10007791,18,,1219152,D,"Maternal Education, Home Environments, and the Development of Children and Adolescents",,,Journal of the European Economic Association,11,S1,123,,,1542-4766,10.1111/j.1542-4774.2012.01096.x,,2013,,2,False,,False,False,,,,1,,True,
10007791,18,,1219157,D,Survey Design and the Analysis of Satisfaction,,,Review of Economics and Statistics,93,3,1087,,,0034-6535,10.1162/REST_a_00202,,2011,,1,False,,False,False,,,,7,,True,
10007791,18,,1219158,D,Perception and retrospection: The dynamic consistency of responses to survey questions on wellbeing,,,Journal of Public Economics,95,3-4,300,,,0047-2727,10.1016/j.jpubeco.2010.08.004,,2011,,0,False,,False,False,,,,2,,True,
10007791,18,,1219166,D,Implementation in mixed Nash equilibrium,,,Journal of Economic Theory,147,6,2357,,,0022-0531,10.1016/j.jet.2012.09.004,,2012,,1,False,,False,False,,,,0,,True,
10007791,18,,1219167,D,Mechanism design and communication networks,,,Theoretical Economics,7,3,489,,,1933-6837,10.3982/TE921,,2012,,1,False,,False,False,,,,1,,True,
10007791,18,,1219168,D,Minimax regret and strategic uncertainty,,,Journal of Economic Theory,145,1,264,,,0022-0531,10.1016/j.jet.2009.07.005,,2010,,1,False,,False,False,,,,7,,True,
10007791,18,,1219169,D,Bilateral commitment,,,Journal of Economic Theory,144,4,1817,,,0022-0531,10.1016/j.jet.2009.03.004,,2009,,2,False,,False,False,,,,3,,True,
10007791,18,,1219178,D,Optimal job design in the presence of implicit contracts,,,RAND Journal of Economics,42,1,44,,,0741-6261,10.1111/j.1756-2171.2010.00125.x,,2011,,1,False,,False,False,,,,1,,True,
10007791,18,,1219179,D,Share the Fame or Share the Blame? The Reputational Implications of Partnerships,,,Journal of Economics & Management Strategy,19,2,259,,,1058-6407,10.1111/j.1530-9134.2010.00252.x,,2010,,1,False,,False,False,,,,0,,True,
10007791,18,,1219181,D,Marrying Up: The Role of Sex Ratio in Assortative Matching,,,American Economic Journal: Applied Economics,3,3,124,,,1945-7782,10.1257/app.3.3.124,,2011,,2,False,,False,False,,,,12,,True,
10007791,18,,1219182,D,The Dynamics Of Names: A Model Of Reputation,,,International Economic Review,52,4,1039,,,0020-6598,10.1111/j.1468-2354.2011.00658.x,,2011,,0,False,,False,False,,,,0,,True,
10007791,18,,1219185,D,The informational divide,,,Games and Economic Behavior,78,1,21,,,0899-8256,10.1016/j.geb.2012.10.016,,2013,,3,False,,False,False,,,,0,,True,
10007791,18,,1219186,D,Oligopolistic markets with sequential search and production cost uncertainty,,,RAND Journal of Economics,42,3,444,,,0741-6261,10.1111/j.1756-2171.2011.00144.x,,2011,,2,False,,False,False,,,,0,,True,
10007791,18,,1219187,D,Imitation and the evolution of Walrasian behavior: Theoretically fragile but behaviorally robust,,,Journal of Economic Theory,145,5,1603,,,0022-0531,10.1016/j.jet.2010.02.014,,2010,,3,False,,False,False,,,,8,,True,
10007791,18,,1219188,D,Contagion and efficiency,,,Journal of Economic Theory,143,1,251,,,0022-0531,10.1016/j.jet.2007.12.003,,2008,,1,False,,False,False,,,,10,,True,
10007791,18,,1219189,D,The long-run cost of job loss as measured by consumption changes,,,Journal of Econometrics,145,1-2,109,,,0304-4076,10.1016/j.jeconom.2008.05.005,,2008,,1,False,,False,False,,,,3,,True,
10007791,18,,1219190,D,Is The Elasticity Of Intertemporal Substitution Constant?,,,Journal of the European Economic Association,9,1,87,,,1542-4766,10.1111/j.1542-4774.2010.01001.x,,2011,,1,False,,False,False,,,,3,,True,
10007791,18,,1219191,D,"Shocks, Stocks, and Socks: Smoothing Consumption Over a Temporary Income Loss",,,Journal of the European Economic Association,7,6,1169,,,1542-4766,10.1162/JEEA.2009.7.6.1169,,2009,,1,False,,False,False,,,,13,,True,
10007791,18,,1219192,D,"Job Loss, Credit Constraints and Consumption Growth",,,Review of Economics and Statistics,n/a,,n/a,,,1530-9142,10.1162/REST_a_00417,,2013,,1,False,,False,False,,,,1,,True,
10007791,18,,1219193,D,Combinatorial Voting,,,Econometrica,80,1,89,,,0012-9682,10.3982/ECTA9294,,2012,,1,False,,False,False,,,,0,,True,
10007791,18,,1219194,D,"Abstention, ideology and information acquisition",,,Journal of Economic Theory,148,3,871,,,0022-0531,10.1016/j.jet.2012.10.006,,2013,,0,False,,False,False,,,,0,,True,
10007791,18,,1449205,D,Child mental health and educational attainment: multiple observers and the measurement error problem,,,Journal of Applied Econometrics,n/a,,n/a,,,08837252,10.1002/jae.2359,,2013,,3,False,,False,False,,,,0,,True,
10007791,18,,1976260,D,Subprime Consumer Credit Demand: Evidence from a Lender's Pricing Experiment,,,Review of Financial Studies,26,9,2353,,,1465-7368,10.1093/rfs/hht029,,2013,,1,False,,False,False,,,,0,,True,
10007791,18,,1976585,D,Estimating Intertemporal Allocation Parameters using Synthetic Residual Estimation,,,Review of Economic Studies,77,4,1231,,,00346527,10.1111/j.1467-937X.2010.00607.x,,2010,,1,False,,False,False,,,,7,,True,
10007791,18,,1976587,D,New evidence on taxes and portfolio choice,,,Journal of Public Economics,94,11-12,813,,,00472727,10.1016/j.jpubeco.2010.09.002,,2010,,3,False,,False,False,,,,3,,True,
10007791,18,,1976590,D,Do disaster expectations explain household portfolios?,,,Quantitative Economics,3,1,1,,,17597323,10.3982/QE128,,2012,,,False,,False,False,,,,0,,True,
10007791,18,,1976602,D,The role of information for retirement behavior: Evidence based on the stepwise introduction of the Social Security Statement,,,Journal of Public Economics,95,7-8,913,,,00472727,10.1016/j.jpubeco.2011.01.003,,2011,,,False,,False,False,,,,2,,True,
10007791,18,,1976608,D,Labor supply effects of the recent social security benefit cuts: Empirical estimates using cohort discontinuities,,,Journal of Public Economics,93,11-12,1224,,,00472727,10.1016/j.jpubeco.2009.07.009,,2009,,,False,,False,False,,,,17,,True,
10007791,18,,1976612,D,"Heterogeneity in Intra-Monthly Consumption Patterns, Self-Control, and Savings at Retirement",,,American Economic Journal: Economic Policy,1,2,163,,,1945-774X,10.1257/pol.1.2.163,,2009,,1,False,,False,False,,,,,,True,
10007791,18,,2028169,D,Market and non-market mechanisms for the optimal allocation of scarce resources,,,Games and Economic Behavior,82,,582,,,0899-8256,10.1016/j.geb.2013.08.008,,2013,,0,False,,False,False,,,,0,,True,
10007791,18,,2028189,D,Competition and Increasing Returns to Scale: A Model of Bank Size,,,The Economic Journal,n/a,,n/a,,,0013-0133,10.1111/ecoj.12104,,2013,,0,False,,False,False,,,,0,,True,
10007791,18,,2657842,U,Inference on Higher-Order Spatial Autoregressive Models with Increasingly Many Parameters,,University of Essex Department of Economics Discussion Paper Series,,,,,,,,,,2013,http://www.essex.ac.uk/economics/discussion-papers/Papers-text/dp735.pdf,1,False,,False,False,,,,,,False,
10007791,18,,2657844,U,"Why are households that report the lowest
incomes so well-off?",,University of Essex Depatment of Economics Discussion Paper Series,,,,,,,,,,2013,http://www.essex.ac.uk/economics/discussion-papers/Papers-text/dp736.pdf,2,False,,False,False,,,,,,False,
10007791,18,,2657863,U,The Condorcet Jur(ies) Theorem.,,University of Essex Department of Economics Discussion Paper Series,,,,,,,,,,2013,http://www.essex.ac.uk/economics/discussion-papers/Papers-text/dp743.pdf,1,False,,False,False,,,,,,False,
10007791,18,,2657934,U,Information Inertia,,Social Science Research Network,,,,,,,,,,2012,http://papers.ssrn.com/sol3/papers.cfm?abstract_id=2084683,,False,,False,False,,,,,,False,
10007791,18,,2663295,D,"Immigration, Offshoring, and American Jobs",,,American Economic Review,103,5,1925,,,0002-8282,10.1257/aer.103.5.1925,,2013,,2,False,,False,False,,,,1,,True,
10007791,18,,2882251,D,Saving up or settling down: Home ownership over the life cycle,,,Review of Economic Dynamics,n/a,,n/a,,,1094-2025,10.1016/j.red.2013.06.002,,2013,,1,False,,False,False,,,,0,,True,
10007791,18,,2926426,U,Popularity,,"University of Essex, Institute of Social and Economic Research (ISER) Working Paper 18475",,,,,,,,,,2009,https://www.iser.essex.ac.uk/publications/working-papers/iser/2009-03.pdf,3,False,,False,False,,,,,,False,
10007791,18,,2926432,U,Trading Partners and Trading Volumes: Implementing the Helpman-Melitz-Rubinstein Model Empirically,,"University of Essex, Department of Economics, Discussion Paper 662",,,,,,,,,,2008,http://www.essex.ac.uk/economics/discussion-papers/Papers-text/dp662.pdf,1,False,,False,False,,,,,,False,
10007791,18,,2968399,U,Clustering in N-Player Preemption Games,,"University of Essex, Department of Economics, Discussion Paper S eries",,,,,,,,,,2013,http://www.essex.ac.uk/economics/discussion-papers/Papers-text/dp741.pdf,1,False,,False,False,,,,,,False,
10007791,18,,2969599,U,Platform Pricing Structure and Moral Hazard,,"University of Essex, Department of Economics, Discussion Paper Series",,,,,,,,,,2013,http://www.essex.ac.uk/economics/discussion-papers/Papers-text/dp738.pdf,1,False,,False,False,,,,,,False,
10007791,18,,2969602,U,Health and the Political Agency of Women,,"University of Essex, Department of Economics, Discussion Paper Series",,,,,,,,,,2013,http://www.essex.ac.uk/economics/discussion-papers/Papers-text/dp739.pdf,1,False,,False,False,,,,,,False,
10007791,18,,2969604,U,The Incapacitation Effect of Incarceration: Evidence from Several Italian Collective Pardons,,"University of Essex, Department of Economics, Discussion Paper Series",,,,,,,,,,2013,http://www.essex.ac.uk/economics/discussion-papers/Papers-text/dp737.pdf,2013,False,,False,False,,,,,,False,
10007791,18,,3040564,U,Demand for Slant: How Abstention Shapes Voters’ Choice of News Media,,"University of Essex, Department of Economics Discussion Paper Series",,,,,,,,,,2013,http://www.essex.ac.uk/economics/discussion-papers/Papers-text/dp734.pdf,1,False,,False,False,,,,,,False,
10007791,18,,3372542,U,Regional Growth and Regional Decline,,"University of Essex, Department of Economics, Discussion Paper Series",,,,,,,,,,2013,https://www.essex.ac.uk/economics/discussion-papers/Papers-text/dp729.pdf,2,False,,False,False,,,,,,False,
10007792,18,,2528546,D,Contracting in the shadow of the law,,,The RAND Journal of Economics,40,3,533,,,17562171,10.1111/j.1756-2171.2009.00076.x,,2009,,1,False,,False,False,,,1,8,,True,
10007792,18,,2528547,D,Optimal allocation without transfer payments,,,Games and Economic Behavior,77,1,1,,,08998256,10.1016/j.geb.2012.08.006,,2013,,1,False,,False,False,,,1,1,,True,
10007792,18,,2528548,D,An experimental investigation of entry cost effects in sealed-bid dollar auctions,,,Economics Letters,111,2,122,,,01651765,10.1016/j.econlet.2011.01.011,,2011,,1,False,,False,False,,,1,0,,True,
10007792,18,,2528549,D,Designing Incentives under Multidimensional Performance Measures,,,Journal of Institutional and Theoretical Economics JITE,168,4,687,,,09324569,10.1628/093245612804469773,,2012,,1,False,,False,False,,,1,0,,True,
10007792,18,,2528550,D,Ambiguity and social interaction,,,Oxford Economic Papers,61,2,355,,,1464-3812,10.1093/oep/gpn030,,2008,,2,False,,False,False,,,1,9,,True,
10007792,18,,2528551,D,The α-MEU model: A comment,,,Journal of Economic Theory,146,4,1684,,,00220531,10.1016/j.jet.2011.03.019,,2011,,3,False,,False,False,,,1,2,,True,
10007792,18,,2528552,D,Are the treasures of game theory ambiguous?,,,Economic Theory,48,2-3,313,,,1432-0479,10.1007/s00199-011-0636-4,,2011,,1,False,,False,False,,,1,6,,True,
10007792,18,,2528561,D,"Mergers, Asymmetries and Collusion: Experimental Evidence",,,The Economic Journal,118,527,387,,,1468-0297,10.1111/j.1468-0297.2007.02126.x,,2008,,1,False,,False,False,,,1,12,,True,
10007792,18,,2528563,D,Explicit vs. tacit collusion - The impact of communication in oligopoly experiments,,,European Economic Review,56,8,1759,,,00142921,10.1016/j.euroecorev.2012.09.002,,2012,,1,False,,False,False,,,1,2,,True,
10007792,18,,2528565,D,An experimental investigation of asymmetric contests,,,International Journal of Industrial Organization,27,5,582,,,01677187,10.1016/j.ijindorg.2009.01.004,,2009,,0,False,,False,False,,,1,7,,True,
10007792,18,,2528567,D,The Advantage of Resource Queues over Spot Resource Markets: Decision Coordination in Experiments under Resource Uncertainty,,,American Journal of Agricultural Economics,94,5,1136,,,1467-8276,10.1093/ajae/aas065,,2012,,2,False,,False,False,,,1,0,,True,
10007792,18,,2528569,D,Learning about the arrival of sales,,,Journal of Economic Theory,146,4,1699,,,00220531,10.1016/j.jet.2011.03.013,,2011,,1,False,,False,False,,,1,0,,True,
10007792,18,,2528572,U,Dynamic Moral Hazard and Stopping,,Economics Department Discussion Papers Series ISSN 1473–3307,,,,,,,,,,2011,http://business-school.exeter.ac.uk/documents/papers/economics/2013/1314.pdf,1,False,,False,False,,,1,,,False,
10007792,18,,2528573,D,"Investment, uncertainty and pre-emption",,,International Journal of Industrial Organization,28,3,278,,,01677187,10.1016/j.ijindorg.2009.09.004,,2010,,1,False,,False,False,,,1,11,,True,
10007792,18,,2528602,D,Asymmetric first-price auctions with uniform distributions: analytic solutions to the general case,,,Economic Theory,50,2,269,,,1432-0479,10.1007/s00199-010-0563-9,,2010,,1,False,,False,False,,,1,5,,True,
10007792,18,,2528604,C,Bayesian Games: Games with Incomplete Information,,Springer New York,"Computational Complexity: Theory, Techniques, and Applications",,,,,9781461418009,,10.1007/978-1-4614-1800-9_16,,2012,,0,False,,False,False,,,1,,,False,
10007792,18,,2528606,D,Leadership games with convex strategy sets,,,Games and Economic Behavior,69,2,446,,,08998256,10.1016/j.geb.2009.11.008,,2010,,1,False,,False,False,,,1,6,,True,
10007792,18,,2528607,D,Extending the Condorcet Jury Theorem to a general dependent jury,,,Social Choice and Welfare,39,1,91,,,1432-217X,10.1007/s00355-011-0546-1,,2011,,1,False,,False,False,,,1,0,,True,
10007792,18,,2528611,U,Decentralised Bilateral Trading in a Market with Incomplete Information,,"Exeter University, Department of Economics Discussion Papers series",,,,,,,,,,2013,http://business-school.exeter.ac.uk/research/areas/topics/economics/outputs/publication/?id=740,0,False,,False,False,,,1,,,False,
10007792,18,,2528612,U,Designing Package Markets to Eliminate Exposure Risk,,University of Zurich Department of Economics Working Paper Series ISSN 1664-705X,,,,,,,,,,2012,http://ssrn.com/abstract=2047008,1,False,,False,False,,,1,,,False,
10007792,18,,2528614,D,The dark side of friendship: ‘envy’,,,Experimental Economics,15,4,547,,,1573-6938,10.1007/s10683-012-9313-0,,2012,,1,False,,False,False,,,1,0,,True,
10007792,18,,2528616,D,The Hidden Advantage of Delegation: Pareto Improvements in a Gift Exchange Game,,,American Economic Review,102,5,2358,,,0002-8282,10.1257/aer.102.5.2358,,2012,,4,False,,False,False,,,1,6,,True,
10007792,18,,2528618,D,Altruism and social integration,,,Games and Economic Behavior,69,2,249,,,08998256,10.1016/j.geb.2009.10.014,,2010,,5,False,,False,False,,,1,17,,True,
10007792,18,,2528619,D,Are women expected to be more generous?,,,Experimental Economics,12,1,93,,,1573-6938,10.1007/s10683-008-9199-z,,2008,,4,False,,False,False,,,1,10,,True,
10007792,18,,2528628,D,Is Reputation Good or Bad? An Experiment,,,American Economic Review,100,5,2187,,,0002-8282,10.1257/aer.100.5.2187,,2010,,1,False,,False,False,,,1,3,,True,
10007792,18,,2528630,D,Learning and risk aversion,,,Journal of Economic Theory,148,1,196,,,00220531,10.1016/j.jet.2012.09.011,,2013,,1,False,,False,False,,,1,0,,True,
10007792,18,,2528631,D,Generalized contest success functions,,,Economic Theory,40,1,139,,,1432-0479,10.1007/s00199-007-0328-2,,2008,,1,False,,False,False,,,1,13,,True,
10007792,18,,2528633,D,Mean and variance responsive learning,,,Games and Economic Behavior,75,2,855,,,08998256,10.1016/j.geb.2012.02.013,,2012,,1,False,,False,False,,,1,0,,True,
10007792,18,,2528635,D,Refined best reply correspondence and dynamics,,,Theoretical Economics,8,1,165,,,19336837,10.3982/TE652,,2013,,2,False,,False,False,,,1,0,,True,
10007792,18,,2528636,U,Neutral Optima in Informed Principal Problems with Common Values,,SSRN,,,,,,,,,,2009,http://papers.ssrn.com/sol3/papers.cfm?abstract_id=1420202,1,False,,False,False,,,1,,,False,
10007792,18,,2528638,U,"Where strategic and evolutionary stability depart -
a study of minimal diversity games",,University of Exeter Economics Department Discussion Paper Series,,,,,,,,,,2009,http://business-school.exeter.ac.uk/research/areas/topics/economics/outputs/publication/?id=538,2,False,,False,False,,,1,,,False,
10007792,18,,2528640,U,Universality of Nash components,,Discussion Paper Series ISSN 1473–3307,,,,,,,,,,2012,http://business-school.exeter.ac.uk/documents/papers/economics/2012/1205.pdf,1,False,,False,False,,,1,,,False,
10007792,18,,2528641,D,Which Way to Cooperate,,,The Economic Journal,122,563,1042,,,00130133,10.1111/j.1468-0297.2011.02485.x,,2011,,1,False,,False,False,,,1,2,,True,
10007792,18,,2528642,D,Optimal rewards in contests,,,The RAND Journal of Economics,39,2,434,,,17562171,10.1111/j.0741-6261.2008.00021.x,,2008,http://www.jstor.org/stable/25474376,2,False,,False,False,,,1,8,,True,
10007792,18,,2528644,D,Learning unethical practices from a co-worker: The peer effect of Jose Canseco,,,Labour Economics,18,3,338,,,09275371,10.1016/j.labeco.2010.10.004,,2011,,1,False,,False,False,,,1,2,,True,
10007792,18,,2528645,D,In search of welfare-improving gifts,,,European Economic Review,53,4,445,,,00142921,10.1016/j.euroecorev.2008.09.002,,2009,,1,False,,False,False,,,1,3,,True,
10007792,18,,3334664,D,"Merger policy, entry, and entrepreneurship",,,European Economic Review,57,,23,,,00142921,10.1016/j.euroecorev.2012.10.006,,2013,,1,False,,False,False,,,1,0,,True,
10007792,18,,3126747,U,Consistent Model Specification Testing,,"Exeter University, Department of Economics Discussion Papers series",,,,,,,,,,2012,http://business-school.exeter.ac.uk/research/areas/topics/economics/outputs/publication/?id=739,1,False,,False,False,,,2,,,False,
10007792,18,,2528553,D,Ratio-based estimators for a change point in persistence,,,Journal of Econometrics,171,1,24,,,03044076,10.1016/j.jeconom.2012.05.024,,2012,,1,False,,False,False,,,2,0,,True,
10007792,18,,2528555,U,Consistent Testing of Functional Form in Time Series Models,,University of Exeter Economics Department Discussion Paper Series,,,,,,,,,,2013,http://people.exeter.ac.uk/jehd201/DavidsonHalunga_dynamics.pdf,1,False,,False,False,,,2,,,False,"Forthcoming in Essays in Nonlinear Time Series Econometrics, eds. Niels Haldrup, Pentti Saikkonen and Mika Meitz (Oxford University Press, 2014).  ISBN - 9780199679959."
10007792,18,,2528559,D,Changes in the order of integration of US and UK inflation,,,Economics Letters,102,1,30,,,01651765,10.1016/j.econlet.2008.10.008,,2009,,2,False,,False,False,,,2,6,,True,
10007792,18,,2528538,D,ALTERNATIVE FREQUENCY AND TIME DOMAIN VERSIONS OF FRACTIONAL BROWNIAN MOTION,,,Econometric Theory,24,01,256,,,1469-4360,10.1017/S0266466608080110,,2007,,1,False,,False,False,,,2,9,,True,
10007792,18,,2528539,D,NOTES AND PROBLEMS A GENERAL BOUND FOR THE LIMITING DISTRIBUTION OF BREITUNG'S STATISTIC,,,Econometric Theory,24,05,1443,,,1469-4360,10.1017/S0266466608080675,,2008,,2,False,,False,False,,,2,0,,True,
10007792,18,,2528540,D,Type I and type II fractional Brownian motions: A reconsideration,,,Computational Statistics & Data Analysis,53,6,2089,15,,01679473,10.1016/j.csda.2008.11.008,,2009,,1,False,,False,False,,,2,7,,True,
10007792,18,,2528541,D,REPRESENTATION AND WEAK CONVERGENCE OF STOCHASTIC INTEGRALS WITH FRACTIONAL INTEGRATOR PROCESSES,,,Econometric Theory,25,06,1589,,,1469-4360,10.1017/S0266466609990260,,2009,,1,False,,False,False,,,2,3,,True,
10007792,18,,2528530,D,"Party Activists, Campaign Funding, and the Quality of Government",,,"Journal of Law, Economics, and Organization",29,1,210,,,1465-7341,10.1093/jleo/ewr030,,2012,,1,False,,False,False,,,3,0,21,True,
10007792,18,,2528531,D,"Bandwagon effects in British elections, 1885–1910",,,Public Choice,157,1-2,73,,,1573-7101,10.1007/s11127-012-0027-9,,2012,,1,False,,False,False,,,3,0,21,True,
10007792,18,,2528532,D,"Economic voting in Britain, 1857–1914",,,Electoral Studies,31,4,668,,,02613794,10.1016/j.electstud.2012.07.006,,2012,,1,False,,False,False,,,3,0,21,True,
10007792,18,,2528533,D,The Treasury and the New Cambridge School in the 1970s,,,Cambridge Journal of Economics,36,4,997,,,1464-3545,10.1093/cje/ber046,,2012,,0,False,,False,False,,,3,1,21,True,
10007792,18,,2528587,D,Seigniorage-Maximizing Inflation under Sticky Prices,,,"Journal of Money, Credit and Banking",42,2-3,503,,,15384616,10.1111/j.1538-4616.2009.00297.x,,2010,,1,False,,False,False,,,3,1,,True,
10007792,18,,2528589,D,"Tax progressivity, income distribution and tax non-compliance",,,European Economic Review,54,4,594,,,00142921,10.1016/j.euroecorev.2009.09.003,,2010,,1,False,,False,False,,,3,2,,True,
10007792,18,,2528590,D,Relative Price Distortions and Inflation Persistence*,,,The Economic Journal,120,547,1080,,,00130133,10.1111/j.1468-0297.2009.02329.x,,2010,,1,False,,False,False,,,3,3,,True,
10007792,18,,2528592,D,Second-order approximation to the Rotemberg model around a distorted steady state,,,Economics Letters,110,2,132,,,01651765,10.1016/j.econlet.2010.11.010,,2011,,1,False,,False,False,,,3,1,,True,
10007792,18,,2528599,U,Female Employment and Fertility - The Effects of Rising Female Wages,,Centre for Economic Performance Discussion Paper No 1156 ISSN 2042-2695,,,,,,,,,,2012,http://cep.lse.ac.uk/pubs/download/dp1156.pdf,0,False,,False,False,,,3,,,False,
10007792,18,,2528600,D,A comment on: “Efficient propagation of shocks and the optimal return on money”,,,Journal of Economic Theory,147,1,382,,,00220531,10.1016/j.jet.2011.11.005,,2012,,1,False,,False,False,,,3,0,,True,
10007792,18,,2528593,D,Is the GATT/WTO's Article XXIV bad?,,,Journal of International Economics,89,1,216,,,00221996,10.1016/j.jinteco.2012.07.007,,2013,,2,False,,False,False,,,4,1,,True,
10007792,18,,2528595,D,Public good differentiation and the intensity of tax competition,,,Journal of Public Economics,92,5-6,1105,,,00472727,10.1016/j.jpubeco.2007.09.009,,2008,,1,False,,False,False,,,4,9,,True,
10007792,18,,2528596,D,Optimum tariffs and retaliation: How country numbers matter,,,Journal of International Economics,78,2,276,,,00221996,10.1016/j.jinteco.2009.04.003,,2009,,0,False,,False,False,,,4,2,,True,
